
;2016-11-25 21:01;4;12;"Delhi HC relief for Modi government on demonetisation http:// indianexpress.com/article/india/ india-news-india/delhi-hc-relief-for-narendra-modi-government-on-demonetisation-4395248/ … pic.twitter.com/158Q65vRmW";;;;"802172889042546688";https://twitter.com/IndianExpress/status/802172889042546688
;2016-11-25 20:48;14;19;"Left parties call 12-hr West Bengal strike on Nov 28 to protest against demonetisation";;;;"802169630676525058";https://twitter.com/IndianExpress/status/802169630676525058
;2016-11-25 18:25;111;92;"Demonetisation : Deposits in Jan Dhan accounts rise to Rs 64,250 crore, says govt http:// indianexpress.com/article/india/ india-news-india/deposits-in-jan-dhan-accounts-rise-to-rs-64250-crore-govt-4394966/ … pic.twitter.com/odSH8NLSSu";;;;"802133710904573954";https://twitter.com/IndianExpress/status/802133710904573954
;2016-11-25 18:15;15;30;"Complaint against Arvind Kejriwal, Mamata Banerjee for demonetisation protest http:// indianexpress.com/article/india/ india-news-india/arvind-kejriwal-mamata-banerjee-demonetisation-protest-criminal-complaint-4394915/ … pic.twitter.com/Hl4EIgCqXh";;;;"802131011756666880";https://twitter.com/IndianExpress/status/802131011756666880
;2016-11-25 18:13;3;20;"Amit Shah says demonetisation flood has united arch rivals in Indian politics http:// indianexpress.com/article/india/ india-news-india/amit-shah-says-demonetisation-flood-has-united-arch-rivals-in-indian-politics-4394867/ … pic.twitter.com/yisKmgVrJP";;;;"802130575767191552";https://twitter.com/IndianExpress/status/802130575767191552
;2016-11-25 17:46;49;39;"Demonetisation to cost Rs 1.28 lakh crore till Dec 30: CMIE http:// indianexpress.com/article/busine ss/demonetisation-cmie-indian-economy-4394729/ … pic.twitter.com/VpKZOnIFs3";;;;"802123813311811584";https://twitter.com/IndianExpress/status/802123813311811584
;2016-11-25 16:32;20;22;"Zakir Naik: IRF was banned amid demonetisation to avert resistance and divert media attention | READ http:// indianexpress.com/article/india/ india-news-india/zakir-naik-irf-ban-demonetisation-4394718/ …";;;;"802105125808373761";https://twitter.com/IndianExpress/status/802105125808373761
;2016-11-25 16:03;12;23;"Demonetisation has hit Congress, SP, BSP, AAP and Mamata hard: Amit Shah | READ http:// indianexpress.com/article/india/ india-news-india/demonetisation-amit-shah-narendra-modi-mamata-banerjee-naveen-patnaik-4394625/ …";;;;"802097815690178560";https://twitter.com/IndianExpress/status/802097815690178560
;2016-11-25 15:29;3;8;"Demonetisation : CM Devendra Fadnavis calls for peoples’ cooperation to end graft http:// indianexpress.com/article/india/ india-news-india/demonetisation-cm-devendra-fadnavis-calls-for-peoples-cooperation-to-end-graft-4394615/ … pic.twitter.com/UmSf96wtPc";;;;"802089280990388224";https://twitter.com/IndianExpress/status/802089280990388224
;2016-11-25 15:02;15;38;"Nitish Kumar backs demonetisation , dismisses fissures in coalition http:// indianexpress.com/article/india/ india-news-india/demonetisation-party-differences-nitish-kumar-courageous-step-bihar-4394564/ … pic.twitter.com/Cn54sNsGWO";;;;"802082423483731969";https://twitter.com/IndianExpress/status/802082423483731969
;2016-11-25 14:59;27;13;"Ex-cashier of SBI commits suicide after demonetisation http:// indianexpress.com/article/india/ india-news-india/ex-cashier-of-sbi-commits-suicide-after-demonetisation-4394580/ … pic.twitter.com/g9Y6tji1n6";;;;"802081784305315842";https://twitter.com/IndianExpress/status/802081784305315842
;2016-11-25 14:59;16;21;"Let PM Modi come to Parliament, everything will be clear: Rahul Gandhi on demonetisation debate http:// indianexpress.com/article/india/ india-news-india/let-pm-modi-come-to-parliament-everything-will-be-clear-rahul-gandhi-on-demonetisation-debate-4394489/ … pic.twitter.com/nL16f5cRvd";;;;"802081686179565568";https://twitter.com/IndianExpress/status/802081686179565568
;2016-11-25 14:36;25;39;"Modi govt can’t just shrug off every criticism of demonetisation http:// indianexpress.com/article/india/ india-news-india/modi-govt-cant-just-shrug-off-every-criticism-of-demonetisation-4394535/ … pic.twitter.com/M7J1wm6EHb";;;;"802075862736613376";https://twitter.com/IndianExpress/status/802075862736613376
;2016-11-25 14:21;27;22;"DMK backs Manmohan Singh's criticism on demonetisation issue http:// indianexpress.com/article/india/ india-news-india/not-meeting-all-party-delegation-a-dangerous-precedent-oomen-chandy-4394521/ … pic.twitter.com/oHPEnJPNk0";;;;"802072279664336896";https://twitter.com/IndianExpress/status/802072279664336896
;2016-11-25 14:09;578;454;"BJP leaders bought many parcels of land before demonetisation , claims report http:// indianexpress.com/article/india/ india-news-india/bjp-leaders-bought-many-parcels-of-land-before-demonetisation-claims-report-4394500/ … pic.twitter.com/JjKirhYlQc";;;;"802069256263172096";https://twitter.com/IndianExpress/status/802069256263172096
;2016-11-25 13:48;17;26;"DMK backs Manmohan Singh’s criticism on demonetisation issue http:// indianexpress.com/article/india/ india-news-india/dmk-backs-manmohan-singhs-criticism-on-demonetisation-issue/ … pic.twitter.com/QY7TieekXM";;;;"802063842737942528";https://twitter.com/IndianExpress/status/802063842737942528
;2016-11-25 13:43;21;30;"Sitaram Yechury targets PM Narendra Modi over demonetisation , dubs him as ‘Tughlaq’ | http:// indianexpress.com/article/india/ india-news-india/sitaram-yechury-targets-pm-narendra-modi-over-demonetisation-dubs-him-as-tughlaq-4394372/ … pic.twitter.com/JQL6V7kk0G";;;;"802062558949556224";https://twitter.com/IndianExpress/status/802062558949556224
;2016-11-25 13:43;8;3;"#ExpressBiz | Demonetisation to have negative impact on growth in short run: Fitch Ratings | http:// indianexpress.com/article/busine ss/economy/demonetisation-to-have-negative-impact-on-growth-in-short-run-fitch-ratings-4394459/ … pic.twitter.com/6HuR1t1D8V";;;#ExpressBiz;"802062525491576832";https://twitter.com/IndianExpress/status/802062525491576832
;2016-11-25 13:22;14;14;"SC to hear all matters pertaining to demonetisation on December 2 | http:// indianexpress.com/article/india/ india-news-india/sc-to-hear-all-matters-pertaining-to-demonetisation-on-december-2-4394376/ … pic.twitter.com/CXWKKpeERC";;;;"802057264320253952";https://twitter.com/IndianExpress/status/802057264320253952
;2016-11-25 11:19;9;4;"Demonetisation LIVE updates: Pandemonium continues as Opposition demands PM Modi be present in house http:// indianexpress.com/article/india/ india-news-india/demonetisation-live-updates-from-parliament-narendra-modi-opposition-4394255/ … pic.twitter.com/QbE2b869n0";;;;"802026283076972544";https://twitter.com/IndianExpress/status/802026283076972544
;2016-11-25 11:13;5;6;"Demonetisation : Exchange of banned Rs 500 and Rs 1,000 notes to continue at RBI counters http:// indianexpress.com/article/busine ss/banking-and-finance/demonetisation-exchange-of-banned-rs-500-and-rs-1000-notes-to-continue-at-rbi-counters-4394203/ … pic.twitter.com/eYSlJ6QoR1";;;;"802024832678260736";https://twitter.com/IndianExpress/status/802024832678260736
;2016-11-25 10:36;36;58;"Those accusing govt of not being prepared for demonetisation were themselves not ready: PM Modi http:// indianexpress.com/article/india/ india-news-india/narendra-modi-on-demonetisation-opposition-parliament-4394142/ … pic.twitter.com/U0bUpLoj4Q";;;;"802015554814906368";https://twitter.com/IndianExpress/status/802015554814906368
;2016-11-25 10:11;7;20;"Opposition does not have anything against demonetisation , says BJP http:// indianexpress.com/article/india/ india-news-india/opposition-does-not-have-anything-against-demonetisation-says-bjp-4394109/ … pic.twitter.com/yxabUxTadi";;;;"802009192861048832";https://twitter.com/IndianExpress/status/802009192861048832
;2016-11-25 06:01;53;40;"Demonetisation : 16,000 Maharashtra cooperative credit societies to hold strike on Dec 1 http:// indianexpress.com/article/india/ india-news-india/demonetisation-16000-maharashtra-cooperative-credit-societies-to-hold-strike-on-dec-1-4393992/ … pic.twitter.com/auxOoLiP2q";;;;"801946473826877444";https://twitter.com/IndianExpress/status/801946473826877444